{
  "$schema": "./contracts/run-result.schema.json",
  "schemaVersion": 1,
  "suite": {
    "name": "AGT-2200 remote-run infrastructure acceptance canary",
    "sourceTaskKey": "AGT-2200",
    "sourceTaskHref": "./acceptance-matrix.json#AGT-2200",
    "chronicleHref": "../../../operations/haertung-verteilte-ausfuehrung/historie.html"
  },
  "generatedAt": "2026-07-29T02:29:16.993Z",
  "runs": [
    {
      "runId": "canary-ref-a",
      "taskKey": "RTS-1",
      "taskHref": "./raw/scenarios/canary-ref-a/result.json",
      "attemptId": "run_43806fcc8e2d4f7cb18cab256bba8afb",
      "attemptHref": "./raw/scenarios/canary-ref-a/result.json#attempt",
      "scenario": {
        "id": "reference-change",
        "manifestHref": "./manifests/reference-change.json"
      },
      "outcome": "baseline",
      "accepted": true,
      "wallMs": 909,
      "phases": [
        {
          "name": "claim",
          "status": "pass",
          "queueMs": 95,
          "executionMs": 38
        },
        {
          "name": "run",
          "status": "pass",
          "queueMs": 25,
          "executionMs": 88
        },
        {
          "name": "gate",
          "status": "pass",
          "queueMs": 11,
          "executionMs": 93
        },
        {
          "name": "review",
          "status": "pass",
          "queueMs": 127,
          "executionMs": 243
        },
        {
          "name": "integration",
          "status": "pass",
          "queueMs": 5,
          "executionMs": 184
        }
      ],
      "tokens": {
        "available": false,
        "reason": "Infrastructure-only deterministic harness; no model or CLI invocation occurred."
      },
      "baseSha": "880bbcd089593d3447cbe47575532a63f2a870ba",
      "resultSha": "ff0bf2e4e6d776d6d7ed84b61e24a534a4ceea71",
      "rawArtifactHref": "./raw/scenarios/canary-ref-a/result.json",
      "components": [
        {
          "name": "source",
          "version": "afee6f812080dbb2dfeac15be4f651552422f275+patch.4d8f6efe1764"
        },
        {
          "name": "Task Server",
          "version": "task-server 1.0.0+sha.unknown"
        },
        {
          "name": "Agent Runner",
          "version": "agent-host 0.1.0+sha.unknown"
        },
        {
          "name": "Studio",
          "version": "v2.11.4 h1:XKxkMTgNSizEvKG6QHue6cAsFOteU2qA61w2tKkCWi0="
        },
        {
          "name": "Docker Engine",
          "version": "29.1.3"
        }
      ],
      "assertions": [
        {
          "id": "declared-terminal",
          "label": "Declared terminal reached",
          "status": "pass",
          "detail": "6-completed matched 6-completed; recovery 0/0 recovery-attempts.",
          "evidenceHref": "./acceptance-matrix.json"
        },
        {
          "id": "phase-timing-present",
          "label": "Phase timing present",
          "status": "pass",
          "detail": "5 executed phases have paired UTC and monotonic boundaries; remaining phases are explicitly skipped.",
          "evidenceHref": "./acceptance-matrix.json"
        },
        {
          "id": "scope-contained",
          "label": "Resources remained scoped",
          "status": "pass",
          "detail": "Fixture workspace, branches, Task Server data, and worktrees were contained under .tmp/remote-test-suite/canary-20260729/reference-change/canary-ref-a.",
          "evidenceHref": "./acceptance-matrix.json"
        },
        {
          "id": "authority-clean",
          "label": "Authority and queues reconciled",
          "status": "pass",
          "detail": "No duplicate claim or unacknowledged outbox item remained in scenario evidence.",
          "evidenceHref": "./acceptance-matrix.json"
        },
        {
          "id": "exact-result-or-nondelivery",
          "label": "Exact result or expected non-delivery",
          "status": "pass",
          "detail": "Exact Result-SHA ff0bf2e4e6d776d6d7ed84b61e24a534a4ceea71 is retained in raw evidence.",
          "evidenceHref": "./acceptance-matrix.json"
        }
      ],
      "incidents": [],
      "links": [
        {
          "label": "Phase journal",
          "href": "./raw/scenarios/canary-ref-a/phases.jsonl"
        },
        {
          "label": "Acceptance matrix",
          "href": "./acceptance-matrix.json"
        }
      ]
    },
    {
      "runId": "canary-ref-b",
      "taskKey": "RTS-1",
      "taskHref": "./raw/scenarios/canary-ref-b/result.json",
      "attemptId": "run_8fabbe9d82a44230a101dad02a6301cc",
      "attemptHref": "./raw/scenarios/canary-ref-b/result.json#attempt",
      "scenario": {
        "id": "reference-change",
        "manifestHref": "./manifests/reference-change.json"
      },
      "outcome": "baseline",
      "accepted": true,
      "wallMs": 1021,
      "phases": [
        {
          "name": "claim",
          "status": "pass",
          "queueMs": 102,
          "executionMs": 35
        },
        {
          "name": "run",
          "status": "pass",
          "queueMs": 26,
          "executionMs": 119
        },
        {
          "name": "gate",
          "status": "pass",
          "queueMs": 12,
          "executionMs": 99
        },
        {
          "name": "review",
          "status": "pass",
          "queueMs": 133,
          "executionMs": 266
        },
        {
          "name": "integration",
          "status": "pass",
          "queueMs": 4,
          "executionMs": 225
        }
      ],
      "tokens": {
        "available": false,
        "reason": "Infrastructure-only deterministic harness; no model or CLI invocation occurred."
      },
      "baseSha": "880bbcd089593d3447cbe47575532a63f2a870ba",
      "resultSha": "ff0bf2e4e6d776d6d7ed84b61e24a534a4ceea71",
      "rawArtifactHref": "./raw/scenarios/canary-ref-b/result.json",
      "components": [
        {
          "name": "source",
          "version": "afee6f812080dbb2dfeac15be4f651552422f275+patch.4d8f6efe1764"
        },
        {
          "name": "Task Server",
          "version": "task-server 1.0.0+sha.unknown"
        },
        {
          "name": "Agent Runner",
          "version": "agent-host 0.1.0+sha.unknown"
        },
        {
          "name": "Studio",
          "version": "v2.11.4 h1:XKxkMTgNSizEvKG6QHue6cAsFOteU2qA61w2tKkCWi0="
        },
        {
          "name": "Docker Engine",
          "version": "29.1.3"
        }
      ],
      "assertions": [
        {
          "id": "declared-terminal",
          "label": "Declared terminal reached",
          "status": "pass",
          "detail": "6-completed matched 6-completed; recovery 0/0 recovery-attempts.",
          "evidenceHref": "./acceptance-matrix.json"
        },
        {
          "id": "phase-timing-present",
          "label": "Phase timing present",
          "status": "pass",
          "detail": "5 executed phases have paired UTC and monotonic boundaries; remaining phases are explicitly skipped.",
          "evidenceHref": "./acceptance-matrix.json"
        },
        {
          "id": "scope-contained",
          "label": "Resources remained scoped",
          "status": "pass",
          "detail": "Fixture workspace, branches, Task Server data, and worktrees were contained under .tmp/remote-test-suite/canary-20260729/reference-change/canary-ref-b.",
          "evidenceHref": "./acceptance-matrix.json"
        },
        {
          "id": "authority-clean",
          "label": "Authority and queues reconciled",
          "status": "pass",
          "detail": "No duplicate claim or unacknowledged outbox item remained in scenario evidence.",
          "evidenceHref": "./acceptance-matrix.json"
        },
        {
          "id": "exact-result-or-nondelivery",
          "label": "Exact result or expected non-delivery",
          "status": "pass",
          "detail": "Exact Result-SHA ff0bf2e4e6d776d6d7ed84b61e24a534a4ceea71 is retained in raw evidence.",
          "evidenceHref": "./acceptance-matrix.json"
        }
      ],
      "incidents": [],
      "links": [
        {
          "label": "Phase journal",
          "href": "./raw/scenarios/canary-ref-b/phases.jsonl"
        },
        {
          "label": "Acceptance matrix",
          "href": "./acceptance-matrix.json"
        }
      ]
    },
    {
      "runId": "canary-net-blip",
      "taskKey": "RTS-1",
      "taskHref": "./raw/scenarios/canary-net-blip/result.json",
      "attemptId": "run_9d298802f1db4a7ba64cd305cdf80806",
      "attemptHref": "./raw/scenarios/canary-net-blip/result.json#attempt",
      "scenario": {
        "id": "fault-task-server-network-blips",
        "manifestHref": "./manifests/fault-task-server-network-blips.json"
      },
      "outcome": "healed",
      "accepted": true,
      "wallMs": 949,
      "phases": [
        {
          "name": "claim",
          "status": "pass",
          "queueMs": 97,
          "executionMs": 42
        },
        {
          "name": "run",
          "status": "pass",
          "queueMs": 25,
          "executionMs": 88
        },
        {
          "name": "gate",
          "status": "pass",
          "queueMs": 13,
          "executionMs": 101
        },
        {
          "name": "review",
          "status": "pass",
          "queueMs": 152,
          "executionMs": 258
        },
        {
          "name": "integration",
          "status": "pass",
          "queueMs": 2,
          "executionMs": 171
        }
      ],
      "tokens": {
        "available": false,
        "reason": "Infrastructure-only deterministic harness; no model or CLI invocation occurred."
      },
      "baseSha": "8cabb3f2ed794bb89fb2a3236baab55beff6dc28",
      "resultSha": "10a95dcf6cbb966fa1d8de0102582a66f542ff2a",
      "rawArtifactHref": "./raw/scenarios/canary-net-blip/result.json",
      "components": [
        {
          "name": "source",
          "version": "afee6f812080dbb2dfeac15be4f651552422f275+patch.4d8f6efe1764"
        },
        {
          "name": "Task Server",